{
  "$schema": "https://json-schema.org/draft/2020-12/schema",
  "$id": "https://opspilot.dev/schemas/fixture.schema.json",
  "title": "Harness Fixture",
  "description": "Evaluation test case (input snapshot); must be redacted",
  "type": "object",
  "additionalProperties": false,
  "required": ["id", "scenario_id", "version", "content_hash", "input", "redacted"],
  "properties": {
    "_comment": {
      "type": "string",
      "description": "Optional human-readable comment; ignored by tooling."
    },
    "id": {
      "type": "string",
      "pattern": "^fix_[a-f0-9]{8}$",
      "description": "fix_<sha8>"
    },
    "scenario_id": {
      "type": "string",
      "pattern": "^scn_[a-z0-9_]+$"
    },
    "version": {
      "type": "string",
      "pattern": "^\\d+\\.\\d+\\.\\d+$"
    },
    "content_hash": {
      "type": "string",
      "pattern": "^sha256:[a-f0-9]{64}$",
      "description": "sha256 of the fixture's serialized input file as written on disk (UTF-8 byte-stream of the JSON file containing the `input` field). Reproducible by `sha256sum <fixture-input-file>`. Avoids canonical-JSON serialization fragility."
    },
    "title": { "type": "string" },
    "description": { "type": "string" },
    "tags": {
      "type": "array",
      "items": { "type": "string" }
    },
    "language": {
      "type": "string",
      "examples": ["zh-CN", "en", "mixed"]
    },
    "input": {
      "type": "object",
      "description": "Scenario-specific structured input; exact fields are defined by the scenario"
    },
    "redacted": {
      "type": "boolean",
      "const": true,
      "description": "The fixture must already be redacted; this field must be true for the fixture to be committed"
    },
    "redaction_rules_version": {
      "type": "string",
      "description": "Version of the redaction rules, for traceability"
    },
    "source": {
      "type": "object",
      "additionalProperties": false,
      "properties": {
        "type": { "type": "string", "enum": ["session", "manual", "public_dataset", "synthetic"] },
        "ref": { "type": "string", "description": "session_id / dataset_url / generator id" },
        "license": { "type": "string", "description": "Required when the source is a public dataset" }
      },
      "required": ["type"]
    },
    "expected_difficulty": {
      "type": "string",
      "enum": ["easy", "medium", "hard", "edge_case"]
    },
    "extensions": {
      "type": "object",
      "default": {}
    }
  }
}
